text,Good/great customer service,Friendly and Helpful Staff,Clear messaging,Trust and reliability,Good offers and promotions,Local and convenient,Atmosphere and environment,Brand appreciation,Easy to use /seamless experience,Best brand around,Fun and entertaining experience,Other,Age,Brand
Great service freindly staff,✓,✓,,,,,,,,,,,55yrs +,Brand A
They are a modern and generous business,,,,,,,,,,,,✓,55yrs +,Brand B
They have good offers and promotions,,,,,✓,,,,,,,,55 to 54yrs,Brand D
Just local and friendly,,,,,,✓,,,,,,,55yrs +,Brand E
Great customer service,✓,✓,,,,,,,,,,,55 to 54yrs,Brand E
Because they have wonderful customer service.,✓,,,,,,,,,,,,55yrs +,Brand C
It's hassle free,,,,,,,,,✓,,,,18 to 34yrs,Brand F
It is friendly and relaxed,,,,,,,✓,,,,,,55yrs +,Brand E
Years using their shops.Clean and tidy.No problems.,,,,,,,✓,,,,,,55yrs +,Brand F
They are good and efficient.,,,,,,,,,✓,,,,55yrs +,Brand C
Nice environment,,,,,,,✓,,,,,,55 to 54yrs,Brand B
Friendly staff and good service,✓,✓,,,,,,,,,,,55yrs +,Brand D
Local and convenient,,,,,,✓,,,,,,,55 to 54yrs,Brand B
"Quick, easy and friendly service",✓,,,,,,,,✓,,,,55 to 54yrs,Brand B
good brand,,,,✓,,,,✓,,,,,55 to 54yrs,Brand E
Tested and trusted,,,,✓,,,,,,,,,18 to 34yrs,Brand D
Ease of putting bets on,,,,,,,,,✓,,,,55yrs +,Brand D
they treat you fair,,,,✓,,,,,,,,,55yrs +,Brand B
Better,,,,,,,,,,,,✓,55 to 54yrs,Brand F
Good,,,,,,,,,,,,✓,18 to 34yrs,Brand C
It's very condusive,,,,,,,✓,,,,,,55 to 54yrs,Brand A
Great company,,,,✓,,,,,,,,,55yrs +,Brand E
Excellent service,✓,✓,,,,,,,,,,,55 to 54yrs,Brand A
Always helpful and efficient.,,✓,,,,,,,✓,,,,18 to 34yrs,Brand C
It's easy to use and friendly staff,,✓,,,,,,,✓,,,,55 to 54yrs,Brand D
Helpful,,,,,,,,,,,,✓,55yrs +,Brand B
Great Staff,,✓,,,,,,,,,,,55yrs +,Brand E
good to deal with,,,,,,,,,,,,✓,55yrs +,Brand D
Because of the great customer service,✓,,,,,,,,,,,,55 to 54yrs,Brand B
Staff always helpful and professional,,✓,,,,,,,,,,,55 to 54yrs,Brand D
They are a trusted brand,,,,✓,,,,✓,,,,,55 to 54yrs,Brand A
Because I trust them,,,,✓,,,,,,,,,18 to 34yrs,Brand A
Good offers,,,,,✓,,,,,,,,18 to 34yrs,Brand D
great staff and offers,,✓,,,,,,,,,,,18 to 34yrs,Brand A
gtreat place to bet,,,,,,,,,,,,✓,18 to 34yrs,Brand B
its a fun friendly and trustable brand,,,,✓,,,,✓,,,✓,,55 to 54yrs,Brand C
Their trustworthy,,,,✓,,,,,,,,,18 to 34yrs,Brand E
Its trustworthy,,,,✓,,,,,,,,,18 to 34yrs,Brand B
Reliable,,,,✓,,,,,,,,,18 to 34yrs,Brand E
Used for years,,,,,,,,,,,,✓,55 to 54yrs,Brand E
Cheap cheerful,,,,,,,,,,,,✓,55 to 54yrs,Brand B
VERY GOOD,,,,,,,,,,,,✓,55 to 54yrs,Brand D
I find them the best there is,,,,,,,,,,✓,,,18 to 34yrs,Brand C
Great,,,,,,,,,,,,✓,18 to 34yrs,Brand D
good deals,,,,,✓,,,,,,,,55 to 54yrs,Brand B
They are worth being recommended because they have a very good way of attending to customers,✓,✓,,,,,,,,,,,18 to 34yrs,Brand C
very useful and has the right prices and service,,,,,,,,,,,,✓,55 to 54yrs,Brand B
They are a friendly and rewarding place to bet with,,✓,,,,,,,,,,,55 to 54yrs,Brand B
They offer a good experience.,,,,,,,,,,,✓,,55 to 54yrs,Brand C
Straightforward,,,,,,,,,,,,✓,55 to 54yrs,Brand A
Best option,,,,,,,,,,✓,,,18 to 34yrs,Brand B
Good offers,,,,,✓,,,,,,,,18 to 34yrs,Brand D
They offer amazing service delivery,✓,,,,,,,,,,,,55 to 54yrs,Brand E
good value and rewards,,,,,✓,,,,,,,,55 to 54yrs,Brand D
because of good service and proper ambiance,,,,,,,✓,,,,,,18 to 34yrs,Brand A
It’s a good service.,✓,,,,,,,,,,,,18 to 34yrs,Brand B
They play fair and pay out promptly,,,,✓,,,,,,,,,18 to 34yrs,Brand C
good customer service,✓,,,,,,,,,,,,18 to 34yrs,Brand A
It is a reliable brand,,,,✓,,,,✓,,,,,18 to 34yrs,Brand B
pleasant experience,,,,,,,,,,,✓,,18 to 34yrs,Brand D
grect,,,,,,,,,,,,✓,55 to 54yrs,Brand E
THEY ARE LIKE AN OLD FRIEND TO ME. SIMPLE AS,,,,✓,,,,,,,,,55yrs +,Brand A
Easy to use and friendly staff,,✓,,,,,,,✓,,,,18 to 34yrs,Brand A
Because their prices are the best,,,,,,,,,,✓,,,55yrs +,Brand C
Clear message and greT shops,,,,,,,,,,,,✓,18 to 34yrs,Brand A
Efficiency,,,,,,,,,,,,✓,18 to 34yrs,Brand C
"Great customer service, easy to use terminals to make bets on",,,,,,,,,✓,,,,18 to 34yrs,Brand B
Offer good deals,,,,,✓,,,,,,,,18 to 34yrs,Brand B
Nice game experience,,,,,,,,,,,✓,,55 to 54yrs,Brand F
Pretty much for the same reason I gave in my previous answer.,,,,,,,,,,,,,55 to 54yrs,Brand C
Already ex[plain why & the easons have not changed.,,,,,,,,,,,,,55yrs +,Brand E
Good experience,,,,,,,,,,,✓,,18 to 34yrs,Brand C
"It has great helpful, knowledgeable staff",,✓,,,,,,,,,,,55 to 54yrs,Brand A
Great customer service,✓,✓,,,,,,,,,,,55 to 54yrs,Brand E
Very friendly helpful staff,,✓,,,,,,,,,,,55 to 54yrs,Brand C
It is a nice friendly place to go,,✓,,,,,✓,,,,,,55 to 54yrs,Brand C
Nice staff,,✓,,,,,,,,,,,18 to 34yrs,Brand C
Good customer service,✓,✓,,,,,,,,,,,18 to 34yrs,Brand A
It is fun and convenient next door.,,,,,,✓,,,,,✓,,55 to 54yrs,Brand F
I always find them very satisfactory fair with no pressure.,,,,,,,,,,,,✓,55yrs +,Brand F
Nice friendly atmosphere,,✓,,,,,✓,,,,,,55yrs +,Brand C
It's a good brand,,,,✓,,,,✓,,,,,55yrs +,Brand F
They are good,,,,,,,,,,,,✓,18 to 34yrs,Brand C
Service is good,✓,,,,,,,,,,,,18 to 34yrs,Brand C
Good offers,,,,,✓,,,,,,,,18 to 34yrs,Brand D
It's a trustworthy brand,,,,✓,,,,✓,,,,,18 to 34yrs,Brand C
Very helpful,,✓,,,,,,,,,,,18 to 34yrs,Brand C
it is easy to use,,,,,,,,,✓,,,,18 to 34yrs,Brand C
Accessible,,,,,,,,,,,,✓,55 to 54yrs,Brand B
Eazy to use,,,,,,,,,✓,,,,55 to 54yrs,Brand C
convenient,,,,,,✓,,,,,,,55yrs +,Brand E
Always had good service,✓,,,,,,,,,,,,55yrs +,Brand C
Good service,✓,,,,,,,,,,,,55 to 54yrs,Brand B
Always been good,,,,,,,,,,,,✓,55 to 54yrs,Brand D
They have better offers,,,,,✓,,,,,,,,55 to 54yrs,Brand B
Easy to bet and helpful staff,,✓,,,,,,,✓,,,,55yrs +,Brand E
easy process,,,,,,,,,✓,,,,55 to 54yrs,Brand B
Always feel welcome,,✓,,,,,,,,,,,55 to 54yrs,Brand B
Because they offer variety of services that suit my interests,,,,,,,,,,,,✓,55 to 54yrs,Brand D
Excellent experience,,,,,,,,,,,✓,,55 to 54yrs,Brand E
Easy and quick to use,,,,,,,,,✓,,,,55 to 54yrs,Brand D
No issues with it,,,,,,,,,,,,✓,55 to 54yrs,Brand E
The staff are friendly and helpful,,✓,,,,,,,,,,,55 to 54yrs,Brand D
Good customer service,✓,✓,,,,,,,,,,,18 to 34yrs,Brand A
It’s friendly and a good place to be,,✓,,,,,✓,,,,,,55 to 54yrs,Brand D
Great customer service and friendly atmosphere,✓,✓,,,,,✓,,,,,,55 to 54yrs,Brand D
There a great service,✓,,,,,,,,,,,,55 to 54yrs,Brand A
Never had any issues,,,,,,,,,,,,✓,55 to 54yrs,Brand C
There service is fast,✓,,,,,,,,,,,,55 to 54yrs,Brand B
Its good,,,,,,,,,,,,✓,18 to 34yrs,Brand F
EASY TO BET WITH AND TRUSTED,,,,✓,,,,,✓,,,,18 to 34yrs,Brand D
Easy to understand,,,,,,,,,✓,,,,18 to 34yrs,Brand B
Trustful,,,,✓,,,,,,,,,55 to 54yrs,Brand F
It's my tried and trusted,,,,✓,,,,,,,,,18 to 34yrs,Brand C
They are very trusted,,,,✓,,,,,,,,,18 to 34yrs,Brand E
For the same reason I previously stated.,,,,,,,,,,,,,18 to 34yrs,Brand C
great employees,✓,,,,,,,,,,,,55 to 54yrs,Brand B
Great trustworthy brand,,,,✓,,,,✓,,,,,55 to 54yrs,Brand D
Good service for me,✓,,,,,,,,,,,,18 to 34yrs,Brand B
Nice,,,,,,,,,,,,✓,18 to 34yrs,Brand C
Because it is trustworthy,,,,✓,,,,,,,,,55 to 54yrs,Brand C
They have a great service,✓,,,,,,,,,,,,18 to 34yrs,Brand C
Great,,,,,,,,,,,,✓,18 to 34yrs,Brand D
Because they are so friendly,,✓,,,,,,,,,,,55 to 54yrs,Brand D
Because I had a great experience with them,,,,,,,,,,,✓,,55 to 54yrs,Brand C
They have good service,✓,✓,,,,,,,,,,,55 to 54yrs,Brand C
Never had a problem,,,,,,,,,,,,✓,55yrs +,Brand D
They have good services,✓,,,,,,,,,,,,18 to 34yrs,Brand C
Good,,,,,,,,,,,,✓,18 to 34yrs,Brand C
They are trustworthy.,,,,✓,,,,,,,,,55 to 54yrs,Brand D
Well laid out with good service,✓,✓,,,,,,,,,,,55 to 54yrs,Brand D
They are safe and have my interests at heart,,,,,,,✓,,,,,,55yrs +,Brand D
I have had good experiences with them,,,,,,,,,,,,✓,55 to 54yrs,Brand D
Excellent site,,,,,,,,,,,,✓,55 to 54yrs,Brand C
Always fair & to the point,,,,✓,,,,,,,,,55yrs +,Brand C
Honest and reliable,,,,✓,,,,,,,,,55yrs +,Brand E
Easy shop or online to bet with make you feel welcome,,,,,,,,,✓,,,,55 to 54yrs,Brand D
Good website,,,,,,,,,,,,✓,18 to 34yrs,Brand B
Always helpful and easy to deal with,,✓,,,,,,,✓,,,,55 to 54yrs,Brand C
Good,,,,,,,,,,,,✓,18 to 34yrs,Brand C
Because the service is quick and easy and the staff were friendly.,,✓,,,,,,,✓,,,,18 to 34yrs,Brand D
Always got good prices on market,,,,,,,,,,,,✓,18 to 34yrs,Brand C
Because I'm very satisfied with my experience,,,,,,,,,,,,✓,18 to 34yrs,Brand E
Friendly service,✓,✓,,,,,,,,,,,18 to 34yrs,Brand C
Good brand,,,,✓,,,,✓,,,,,55 to 54yrs,Brand E
Great offers,,,,,✓,,,,,,,,18 to 34yrs,Brand C
Easy to use and staff were friendly,,✓,,,,,,,✓,,,,18 to 34yrs,Brand E
Nice to do business with,,,,,,,,,,,,✓,55 to 54yrs,Brand C
it is a good service,✓,,,,,,,,,,,,18 to 34yrs,Brand D
Great friendly service,✓,✓,,,,,,,,,,,55yrs +,Brand F
it has everything that suits my needs,,,,,,,,,,,,✓,18 to 34yrs,Brand B
They are very friendly and professional they are always there to deal with any enquiries,,✓,,,,,,,,,,,18 to 34yrs,Brand C
Good company,,,,✓,,,,,,,,,18 to 34yrs,Brand C
Everything you need,,,,,,,,,,,,✓,18 to 34yrs,Brand F
friendly staff,,✓,,,,,,,,,,,55yrs +,Brand C
Polite and friendly staff,,✓,,,,,,,,,,,18 to 34yrs,Brand E
The interface of their app is easy to navigate & transaction is done quickly,,,,,,,,,✓,,,,18 to 34yrs,Brand D
Its great,,,,,,,,,,,,✓,55 to 54yrs,Brand C
Provide a good service,✓,,,,,,,,,,,,55 to 54yrs,Brand C
It's easy to understand betting with them the process is not complicated,,,,,,,,,✓,,,,55 to 54yrs,Brand C
good,,,,,,,,,,,,✓,18 to 34yrs,Brand C
Always find it a pleasant place to be,,,,,,,✓,,,,✓,,55yrs +,Brand C
"Good offers , seems player friendly",,,,,✓,,,,,,,,18 to 34yrs,Brand C
For relax no risk,,,,,,,,,,,✓,,18 to 34yrs,Brand C
It's reliable,,,,✓,,,,,,,,,55 to 54yrs,Brand E
Good clean environment good odds,,,,,,,✓,,,,,,55yrs +,Brand C
Best in the market,,,,,,,,,,✓,,,18 to 34yrs,Brand B
easy to join,,,,,,,,,✓,,,,18 to 34yrs,Brand B
Often win,,,,,,,,,,,,✓,55 to 54yrs,Brand B
good shop all round,,,,,,,,,,,,✓,55yrs +,Brand C
"It's really easy to bet with them, they do good promotions and the in-store staff are really friendly.",,,,,,,,,✓,,,,18 to 34yrs,Brand D
It's a pleasant shopping experience,,,,,,,,,,,,✓,55 to 54yrs,Brand B
Very good shop,,,,,,,,,,,,✓,55 to 54yrs,Brand C
I have always found coral to be fair,,,,✓,,,,,,,,,55yrs +,Brand A
The staff are helpful and always willing to advisr,,✓,,,,,,,,,,,55 to 54yrs,Brand C
Similar tastes to mine,,,,,,,,,,,,,55 to 54yrs,Brand D
They will enjoy losing the money at Boyles,,,,,,,,,,,,,55 to 54yrs,Brand F
"I used to bet with Boyle sport. They have good offers , odds",,,,,,,,,,,,✓,55 to 54yrs,Brand F
Its got nice not judgemental staff,,✓,,,,,,,,,,,55 to 54yrs,Brand C
Like it it's near,,,,,,✓,,,,,,,55 to 54yrs,Brand D
very good atmosphere,,,,,,,✓,,,,,,55yrs +,Brand C
My favourite,,,,,,,,,,,,✓,55 to 54yrs,Brand C
"They offer great prices, ways to place a bet on many markets, and they reward you well as a customer",✓,,,,,,,,,,,,55yrs +,Brand D
i like them,,,,,,,,,,,,✓,55 to 54yrs,Brand C
Great prices and offers on accumulators,,,,,✓,,,,,,,,55yrs +,Brand B
It's close to where I live and the staff are very nice,,✓,,,,,,,,,,,18 to 34yrs,Brand F
its just amazing and i love sports betting,,,,,,,,,,,✓,,18 to 34yrs,Brand D
Because I use it and would like a companion,,,,,,,✓,,,,,,55 to 54yrs,Brand C
Trustworthy relevant. Modern,,,,✓,,,,,,,,,55yrs +,Brand B
It’s my favourite,,,,,,,,,,,,✓,55 to 54yrs,Brand C
"Make gambling fun, alway's a good atmosphere in the shop, plenty of promotion's on offer and never a problem when paying out winnings.",,,,,,,✓,,,,✓,,55 to 54yrs,Brand C
They are brilliant,,,,,,,,,,,,✓,18 to 34yrs,Brand B
My Customer experience over the last ten years,✓,,,,,,,,,,,,55yrs +,Brand F
Staff know how,✓,,,,,,,,,,,,55yrs +,Brand C
"They are very unique and located everywhere in the country and also great staff and friendly service, nice atmosphere",,✓,,,,,✓,,,,,,55 to 54yrs,Brand F
I love this brand,,,,,,,,✓,,,,,18 to 34yrs,Brand C
because of tge comment i applied last time is the same experience i have everytime i go in.,,,,,,,,,,,,✓,55 to 54yrs,Brand E
Good staff and environment,,✓,,,,,,,,,,,18 to 34yrs,Brand A
to play with them,,,,,,,,,,,,✓,55yrs +,Brand B
Great range of bets good customer service,✓,,,,,,,,,,,,55 to 54yrs,Brand C
Great place,,,,,,,,,,,,✓,18 to 34yrs,Brand B
That is my opinion,,,,,,,,,,,,✓,55 to 54yrs,Brand D
It’s good fun,,,,,,,,,,,✓,,55 to 54yrs,Brand B
Lots of offers and bonuses,,,,,✓,,,,,,,,55 to 54yrs,Brand C
they have a great selection of offers and deals,,,,,✓,,,,,,,,55 to 54yrs,Brand C
"It my favorite, so I'll definitely recommend it",,,,,,,,,,✓,,,18 to 34yrs,Brand A
Because they have good service and variety of games,,,,,,,,,,,,✓,18 to 34yrs,Brand D
Great offers free bets,,,,,✓,,,,,,,,55 to 54yrs,Brand D
It’s got the best vibe,,,,,,,✓,,,✓,,,55 to 54yrs,Brand D
A reputable brand who always honour bets,,,,,,,,✓,,,,,18 to 34yrs,Brand D
I have been betting with william hills for a while now and i an use to them,,,,✓,,,,,,,,,55 to 54yrs,Brand D
leader,,,,,,,,,,,,✓,55 to 54yrs,Brand D
not sure,,,,,,,,,,,,,18 to 34yrs,Brand C
To bet,,,,,,,,,,,,,18 to 34yrs,Brand C
It’s a great company,,,,✓,,,,,,,,,18 to 34yrs,Brand A
"Pretty much as before, staff are friendly and helpful, it’s easy to go in grab your slip and place your bets",,,,,,,,,✓,,,,18 to 34yrs,Brand D
Friendly staff and good access to all forms of betting,,✓,,,,,,,,,,,55yrs +,Brand D
lot of freebies,,,,,✓,,,,,,,,55yrs +,Brand A
I feel respected,,,,,,,,,,,,✓,18 to 34yrs,Brand C
Love going in their and the staff are always helofull and friendly,,✓,,,,,,,,,,,55 to 54yrs,Brand B
because the shop I use is always clean and the staff are great,,,,,,,✓,,,,,,55yrs +,Brand D
Good book makers,,,,,,,,,,,,✓,18 to 34yrs,Brand C
They have lots of in-store special offers. The stores are bright n lots of room,,,,,✓,,,,,,,,55 to 54yrs,Brand C
I am quite satisfied with Paddy Power,,,,,,,,,,,,✓,55 to 54yrs,Brand C
Love it,,,,,,,,,,,,✓,18 to 34yrs,Brand C
Always professional. One of the best in the business,,,,,,,,,,✓,,,55 to 54yrs,Brand F
Only one I consider,,,,,,,,,,✓,,,18 to 34yrs,Brand C
Myself & my family have always placed bets with Paddy Power & I like to support it because it's an Irish company. They make betting easy for me.,,,,✓,,,,,✓,,,,55 to 54yrs,Brand C
If you want to do a small bet the odd time it gives the best odds,,,,,,,,,,✓,,,18 to 34yrs,Brand C
Good offers with bets,,,,,✓,,,,,,,,18 to 34yrs,Brand B
As well as being welcoming and helpful. They've been around a long time and are very trustworthy,,✓,,✓,,,,,,,,,55 to 54yrs,Brand C
various markets across alot of sports good odds,,,,,,,,,,,,✓,18 to 34yrs,Brand C
"Aithniúil mar gheall ar a dtairiscintí éagsúla agus a thiomantas do chothrom na féinne,",,,,,,,,,,,,,18 to 34yrs,Brand B
As I've played here and it is very fun and interesting,,,,,,,,,,,✓,,18 to 34yrs,Brand C
Úsáideann an soláthraí seo an praghas a bhuaigh níos fearr,,,,,,,,,,,,,55 to 54yrs,Brand B
My favourite,,,,,,,,,,,,✓,55 to 54yrs,Brand C
I love it,,,,,,,,,,,,✓,18 to 34yrs,Brand C
They need to experience lock of the irish. -Ooohh thats a nice win derr!!',,,,,,,,,,,,,18 to 34yrs,Brand B
I’ve always used them I think they are the best odds with this company,,,,✓,,,,,,✓,,,55 to 54yrs,Brand C
"ive laways had good expieriences in the shop over the years, never really had a bad exp",,,,,,,,,,,✓,,55 to 54yrs,Brand F
They are one of the best on the high street,,,,,,,,,,✓,,,55 to 54yrs,Brand B
"good odds, good atmosphere",,,,,,,✓,,,,,,55 to 54yrs,Brand B
honest party,,,,✓,,,,,,,,,55yrs +,Brand D
I trusted bookmaker,,,,✓,,,,,,,,,55yrs +,Brand B
Brilliant,,,,,,,,,,,,✓,18 to 34yrs,Brand D
"I like the amphshere in the store,It is easy to do sports betting in the store.",,,,,,,,,✓,,,,55yrs +,Brand C
Because they are an excellent well established company that have been around for a long time,,,,✓,,,,,,,,,55 to 54yrs,Brand D
It's by my house so it's the nearest bookies I could recommend,,,,,,✓,,,,,,,55 to 54yrs,Brand D
You will surely win.,,,,,,,,,,,,✓,18 to 34yrs,Brand A
"Although cannot be classed as a Regular, I am comfortable with being in the establishment",,,,,,,✓,,,,,,55yrs +,Brand D
I feel that they are the best for odds.,,,,,,,,,,✓,,,55 to 54yrs,Brand B
They have the best odds and you can bet on a wide range of sports or events the staff are always friendly and knowledgable,,,,,,,,,,✓,,,55 to 54yrs,Brand D
ggdsf gdsfg fdsg dsfg dfsg dfsg,,,,,,,,,,,,,55 to 54yrs,Brand D
Great place,,,,,,,,,,,,✓,18 to 34yrs,Brand B
is very good brand,,,,,,,,✓,,,,,55yrs +,Brand C
the ensure safe gambling and have quick payouts,,,,,,,✓,,,,,,55 to 54yrs,Brand C
its the best brand overall,,,,✓,,,,✓,,✓,,,18 to 34yrs,Brand B
BECAUSE IT HAS ANYONE TO GET TO MAKE THAT YOU WILL GET IT HAS,,,,,,,,,,,,,55 to 54yrs,Brand C
Could for betting,,,,,,,,,,,,✓,18 to 34yrs,Brand C
It’s great,,,,,,,,,,,,✓,18 to 34yrs,Brand D
"Welcome to Gboard clipboard, any text you copy will be saved here.",,,,,,,,,,,,✓,55 to 54yrs,Brand E
"They have a positive attitude to their customers, they have some great offers and reward loyalty.",,✓,,,✓,,,,,,,,55yrs +,Brand B
Good bet offers,,,,,✓,,,,,,,,55 to 54yrs,Brand D
ALL WAYS OFFER A GOOD SELECTION OF ODDS AND BETS,,,,,,,,,,,,✓,55yrs +,Brand E
Innovative brand,,,,,,,,✓,,,,,18 to 34yrs,Brand D
You can top up your online account in store.,,✓,,,,,,,,,,,55 to 54yrs,Brand C
They are the best for horse racing,,,,,,,,,,✓,,,55 to 54yrs,Brand D
"Ardán atá Cairdiúil le hÚsáideoirí: Is furasta do go leor úsáideoirí suíomh Gréasáin agus aip shoghluaiste Ladbrokes a nascleanúint agus a úsáid, le comhéadain iomasach a fhágann go bhfuil gealltóireacht agus cearrbhachas áisiúil",,,,,,,✓,,,,,,18 to 34yrs,Brand B
its rewarding policy to loyal customers,,,,✓,,,,,,,,,55 to 54yrs,Brand B
Staff and prices,,✓,,,,,,,,,,,55yrs +,Brand D
great company great staff,,✓,,✓,,,,,,,,,55 to 54yrs,Brand D
Trust the brand,,,,✓,,,,✓,,,,,55 to 54yrs,Brand B
Yes,,,,,,,,,,,,✓,55 to 54yrs,Brand A
Because it’s fun,,,,,,,,,,,✓,,18 to 34yrs,Brand C
Good betting office,,,,,,,,,,,,✓,55 to 54yrs,Brand D
accessible locations,,,,,,,,,,,,✓,55 to 54yrs,Brand C
Great atmosphere there,,,,,,,✓,,,,,,55 to 54yrs,Brand C
it had a great bet that pay out fast,,,,,,,,,,,,✓,55 to 54yrs,Brand D
Best in the business top shop top staff,,,,,,,,,,✓,,,18 to 34yrs,Brand C
A place which gives me a sense of belonging,,,,,,,✓,,,,✓,,18 to 34yrs,Brand D
Clean shop friendly staff not too busy,,✓,,,,,✓,,,,,,18 to 34yrs,Brand D
Great choice of bets and fun,,,,,,,,,,,✓,,55 to 54yrs,Brand C
Because they're the best,,,,,,,,,,✓,,,18 to 34yrs,Brand D
Because their customer service is amazing,✓,,,,,,,,,,,,18 to 34yrs,Brand A
Really cool vibe in store,,,,,,,✓,,,,,,55 to 54yrs,Brand B
Because their odds they promise that u can get your money back,,,,,,,,,,,,✓,18 to 34yrs,Brand B
Goodluck,,,,,,,,,,,,✓,18 to 34yrs,Brand E
Is branda cearrbhachais i bhfad suimiúil é seo,,,,,,,,✓,,,,,18 to 34yrs,Brand B
Níos tábhachtaí úsáideach,,,,,,,,,,,,,55 to 54yrs,Brand B
maith le haghaidh imirt,,,,,,,,,,,,,18 to 34yrs,Brand B
"Cosúil le go leor cuideachtaí cearrbhachais traidisiúnta eile, tá infheistíocht déanta ag Ladbrokes in ardáin dhigiteacha agus seirbhísí ar líne",,,,,,,,,,,,,18 to 34yrs,Brand B
iontach,,,,,,,,,,,,,18 to 34yrs,Brand B
its the closest to my location,,,,,,✓,,,,,,,55yrs +,Brand C
Customer Service,✓,,,,,,,,,,,,18 to 34yrs,Brand C
Brilliant,,,,,,,,,,,,✓,18 to 34yrs,Brand D
taitneamhach,,,,,,,,,,,,,18 to 34yrs,Brand B
Always happy to help and great deals,,,,,✓,,,,,,,,18 to 34yrs,Brand B
"Happy customers good games,and every week promotion",,,,,✓,,,,,,,,18 to 34yrs,Brand A
pleasant surroundings clean nice staff,,✓,,,,,✓,,,,,,55yrs +,Brand C
Léirithe níos fearr agus níos mó,,,,,,,,,,,,,55 to 54yrs,Brand B
"Le líonra mór siopaí gealltóireachta miondíola agus ardán ar líne, soláthraíonn Ladbrokes rochtain éasca",,,,,,,,,,,,,55 to 54yrs,Brand B
i bhfad sásta,,,,,,,,,,,,,18 to 34yrs,Brand B
i bhfad suimiúil,,,,,,,,,,,,,18 to 34yrs,Brand B
It’s very good,,,,,,,,,,,,✓,55yrs +,Brand C
Also clean and tidy staff are excellent,,✓,,,,,✓,,,,,,55 to 54yrs,Brand C
Staff,,,,,,,,,,,,✓,55 to 54yrs,Brand E
Its the best one,,,,,,,,,,✓,,,18 to 34yrs,Brand C
Fun and safe and supportive,,,,,,,✓,,,,✓,,55yrs +,Brand A
Good in shop offers,,,,,✓,,,,,,,,55 to 54yrs,Brand C
"Odds are good, shops are clean and safe; I also like the novelty bets",,,,,,,✓,,,,,,55yrs +,Brand C
Cause its a goo betting shop and u get loafs of deals,✓,✓,,,,,,,,,,,18 to 34yrs,Brand A
Just like the shop,,,,,,,,,,,,✓,55 to 54yrs,Brand C
Great shops with state of the art equipment including betting terminals,,,,,,,✓,,,,,,55 to 54yrs,Brand F
"I like the ambience if their shops, and their odds are competitive.",,,,,,,✓,,,,,,55 to 54yrs,Brand E
"nice atmosphere, shop",,,,,,,✓,,,,,,18 to 34yrs,Brand A
they are the best betting shops,,,,,,,,,,✓,,,18 to 34yrs,Brand D
Because it is a good betting shop,,,,,,,,,,,,✓,18 to 34yrs,Brand E
Nice shop and good location. Staff are very nice too,,✓,,,,,,,,,,,55 to 54yrs,Brand C
I just prefer the Ladbrokes shop and staff,,✓,,,,,,,,,,,55yrs +,Brand B
"Great atmosphere in the shop, plenty of money back offer's, extra place's on sport's bet including horse racing.",,,,,,,✓,,,,,,55 to 54yrs,Brand C
customer service odds on offer clean shop,,,,,,,✓,,,,,,55yrs +,Brand C
NICE SHOPS,,,,,,,,,,,,✓,18 to 34yrs,Brand E
It's the best betting shop provider I have experienced,,,,,,,,,,✓,,,18 to 34yrs,Brand C
Good atmosphere In shops good odds,,,,,,,✓,,,,,,55 to 54yrs,Brand E
IT'S A VERY WELCOMING SHOP,,,,,,,,,,,,✓,55yrs +,Brand D
a nice shop,,,,,,,,,,,,✓,55 to 54yrs,Brand B
It’s a convenient location and the shop is clean and well presented with friendly staff.,,✓,,,,,✓,,,,,,55yrs +,Brand B
I like the staff and the environment in the shop,,✓,,,,,,,,,,,55 to 54yrs,Brand D
It’s a great betting shop,,,,,,,,,,,,✓,18 to 34yrs,Brand A
I love how straightforward and clear the brand's message is.,,,✓,,,✓,,,,,,,55yrs +,Brand C
The brand's messaging is crystal clear; it really resonates with me.,,,✓,,,,,,,,,,55yrs +,Brand F
"Finally, a brand that knows how to communicate clearly and effectively!",,,✓,,,,,,,,,,18 to 34yrs,Brand D
The clarity in the brand's messaging makes it easy for me to understand what they stand for.,,,✓,,,,,,,,,,55yrs +,Brand E
It's refreshing to see a brand with such clear messaging in today's cluttered market.,,,✓,,,,,,,,,,18 to 34yrs,Brand D
I appreciate how the brand's messaging cuts through the noise and gets straight to the point.,,,✓,,,,,,,,,,55yrs +,Brand E
The brand's clear messaging is what drew me in initially and has kept me as a loyal customer.,,,✓,,,,,,,,,,55yrs +,Brand E
I trust the brand more because of their clear and concise messaging.,,,✓,,,,,,,✓,,,18 to 34yrs,Brand B
Their messaging leaves no room for confusion; it's straightforward and honest.,,,✓,,,,,,,,,,55 to 54yrs,Brand A
The brand's clear messaging sets them apart from their competitors.,,,✓,,,,,,,,,,55 to 54yrs,Brand D
I instantly connected with the brand because of their clear messaging.,,,✓,,,,,,,,,,55 to 54yrs,Brand D
The brand's messaging makes it easy for me to understand their values and mission.,,,✓,,,,,,✓,,,,18 to 34yrs,Brand A
"Clear messaging is crucial for me when choosing a brand, and this one nails it.",,,✓,,,,,,,✓,,,55 to 54yrs,Brand D
The brand's messaging makes me feel confident in my decision to support them.,,,✓,,,,,,✓,,,,55 to 54yrs,Brand C
I admire the brand's commitment to keeping their messaging simple and clear.,,,✓,,,,,,,✓,,,18 to 34yrs,Brand B
The brand's messaging speaks directly to me; it's like they understand exactly what I need.,,✓,✓,,,,,,,✓,,,18 to 34yrs,Brand C
"In a world full of confusing advertisements, the brand's messaging stands out for its clarity.",,,✓,✓,,,✓,,,,,,18 to 34yrs,Brand B
I appreciate how the brand's messaging is consistent across all their platforms.,,,✓,,,,,,,,,,55 to 54yrs,Brand A
Their clear messaging makes me feel like they respect my time as a consumer.,,,✓,,,,,,,,,,18 to 34yrs,Brand C
I wish more brands would follow the example of this one and prioritize clear messaging.,,,✓,,,,,,,,,,55 to 54yrs,Brand C
The brand's messaging is like a breath of fresh air in a sea of ambiguity.,,,✓,,,,,,,,,,55yrs +,Brand E
I never have to second-guess what the brand is trying to convey; their messaging is always crystal clear.,,,✓,,,,,,,✓,,,18 to 34yrs,Brand C
The brand's clear messaging builds trust and credibility in my eyes.,,,✓,,,,,,✓,,,,55 to 54yrs,Brand D
